File Names/Locations and Preferences,,Notes,,,,
Simulation Title,"rule_curve_1_sedmgmt_deterministic, rule_curve_1_sedmgmt_stochastic, rule_curve_1_nosedmgmt_deterministic, rule_curve_1_nosedmgmt_stochastic, rule_curve_2_sedmgmt_deterministic, rule_curve_2_sedmgmt_stochastic, rule_curve_2_nosedmgmt_deterministic, rule_curve_2_nosedmgmt_stochastic, rule_curve_3_sedmgmt_deterministic, rule_curve_3_sedmgmt_stochastic, rule_curve_3_nosedmgmt_deterministic, rule_curve_3_nosedmgmt_stochastic",Required (Old: Sambor Original),,,,"rule_curve_3_sedmgmt_deterministic, rule_curve_3_sedmgmt_stochastic, rule_curve_3_nosedmgmt_deterministic, rule_curve_3_nosedmgmt_stochastic"
Input file folder path,input,"Required; Be sure to adjust so convention reflects operating system in use, e.g. './Output_Storage/Scenarios_Input_Data'  in Linux",,,,
Input file name,,"If blank, will append "" - Simulation_Title.xlsx"" to ""PySedSim_Input_File""",,,,
Monte carlo input file,"Parameters_for_MC_Historical.xlsx, Parameters_for_MC_Stochastic.xlsx, Parameters_for_MC_Historical.xlsx, Parameters_for_MC_Stochastic.xlsx, Parameters_for_MC_Historical.xlsx, Parameters_for_MC_Stochastic.xlsx, Parameters_for_MC_Historical.xlsx, Parameters_for_MC_Stochastic.xlsx, Parameters_for_MC_Historical.xlsx, Parameters_for_MC_Stochastic.xlsx, Parameters_for_MC_Historical.xlsx, Parameters_for_MC_Stochastic.xlsx",,,,,"Parameters_for_MC_Historical.xlsx, Parameters_for_MC_Stochastic.xlsx, Parameters_for_MC_Historical.xlsx, Parameters_for_MC_Stochastic.xlsx"
Simulation output file path,output,"Required; Be sure to adjust so convention reflects operating system in use, e.g. './Output_Storage' in Linux to store directly in sub-folder",,,,
